basepk,hid,speechdate,pid,opid,speakeroldname,speakerposition,maintopic,subtopic,subsubtopic,speechtext,speakerparty,speakerriding,speakername,speakerurl
536419,ca.proc.d.1919-06-06.7.3,1919-06-06,5e8a24b4-f155-4f3d-aacc-e6da13c93756,ca.m.4254,Sir ROBERT BORDEN (Prime Minister):,Prime Minister; Secretary of State for External Affairs,STRIKING POSTAL EMPLOYEES.,,,"I have received communications ot a similar character, and I have made replies to them which I would have been very glad to bring down to the House had I knowu my hon. friend intended to a*k this question to-day.
The situation so far as the postal employees are concerned, whether at Winnipeg or elsewhere, is very simple. In. Winnipeg they went out on a sympathetic strike although they had no grievance of their own and they were given a period of between two and three days within which to return to their duty. They were distinctly and emphatically informed that if they did not [Sir Robert Rorden.j
return to their duty by Monday noon, the 26th of May, they must regard themselves as permanently retired from the public service. I understand that a very considerable number of them were disposed to return, and seventy of them did return. The others were deterred, I understand, by the assertion made to them by interested people that the Government was ""bluffing"" and would not dare to carry out its proposal in regard to the men who had thus deserted their duty in the public service. A very distinct intimation was sent by telegram to Calgary, to Edmonton, and to every other western city in which strikes had not then taken place, but where there seemed a possibility that the employees in the public service would go out on a sympathetic strike. That telegram has already been communicated to the House, and will be found at page 2957 of the unrevised Hansard of the 27th of May, 1919. *L need not read it again.	*
It was a distinct and emphatic intimation to the postal employees that if they undertook to go out on a sympathetic strike, disregard their public duty, accept the direction of another authority than the Government, dislocate the public service of this country, and occasion widespread public inconvenience, they must regard themselves as permanently retired from the public service of this country.
I have had a great many communications on the subject since, and I have sent replies. I do not think it is worth while reading them to the House, but I am perfectly prepared to do so at any time if my hon. friend so desires. I can only say that the Government, having taken this position, and taken it, I think, with good cause, would render no good service to the public interest by withdrawing from it. There was the most plain and positive intimation to all these employees as to the result of the course which they proposed to take, and having given that warning I do not think they are at liberty to blame the Government of this country. They have no one to blame but themselves and those who induced them to engage in this sympathetic strike. I greatly regret that they find themselves in their present position.

",Unionist,,Robert Laird Borden,http://www.parl.gc.ca/parlinfo/Files/Parliamentarian.aspx?Item=5e8a24b4-f155-4f3d-aacc-e6da13c93756&Language=E&Section=ALL
536420,ca.proc.d.1919-06-06.8,1919-06-06,,,,topic,CONFERENCE BETWEEN EMPLOYERS AND EMPLOYED SUGGESTED.,,,,,,,
536468,ca.proc.d.1919-06-06.9.44,1919-06-06,c1b69015-0348-4ed6-8d8a-3de18e5d1742,ca.m.2824,Sir SAM HUGHES:,,PURCHASING OF DEPARTMENTAL AND OTHER SUPPLIES.,,,"They will be directly under the Prime Minister?

",Unionist,,Samuel Hughes,http://www.parl.gc.ca/parlinfo/Files/Parliamentarian.aspx?Item=c1b69015-0348-4ed6-8d8a-3de18e5d1742&Language=E&Section=ALL
536439,ca.proc.d.1919-06-06.9.15,1919-06-06,a43fcba7-73d8-48ff-b457-5740c40cecab,ca.m.3293,Mr. ROWELL:,Minister presiding over the Department of Health; President of the Privy Council,PURCHASING OF DEPARTMENTAL AND OTHER SUPPLIES.,,,"It is not. Only the Canadian National railways are excepted. As a railway organization, including the Canadian Northern, they have their own purchasing branch, but the Railway Department comes under this Bill, as do all other departments.

",Unionist,,Newton Wesley Rowell,http://www.parl.gc.ca/parlinfo/Files/Parliamentarian.aspx?Item=a43fcba7-73d8-48ff-b457-5740c40cecab&Language=E&Section=ALL
536411,ca.proc.d.1919-06-06.5.1.1.1,1919-06-06,,,,stagedirection,,,,Bill No. 124 (from the Senate) for the relief of Andrew Pepper.-Mr. Campbell.,,,,
536414,ca.proc.d.1919-06-06.6.1.1.1,1919-06-06,,,,stagedirection,,,,On the Orders of the Day:,,,,
536417,ca.proc.d.1919-06-06.7.1.1,1919-06-06,,,,stagedirection,,,,"On the Orders of the Day:
Mr. D. D. MeKENZIE (Leader of the Opposition): I received a telegram yesterday from Calgary which I handed to the Acting Minister of Trade and Commerce (Mr. Maclean), thinking he might be able to give some reply in regard to it to-day. I did not show it to the Prime Minister, as I thought the Acting Minister of Trade and Commerce would be present, but he is not in his seat just now. This telegram, which has reference to post office matters in the city of Calgary, reads as follows:
With the exception ot one, the entire staff of Calgary post office withdrew from duty on May twenty-sixth, and Government states men cannot return. These employees belong to an organization officially recognized by Government and their constitution includes strike weapon, which has never been objected to. Government's action cannot be construed as anything but an attack on labour-",,,,
536445,ca.proc.d.1919-06-06.9.21,1919-06-06,a43fcba7-73d8-48ff-b457-5740c40cecab,ca.m.3293,Mr. ROWELL:,Minister presiding over the Department of Health; President of the Privy Council,PURCHASING OF DEPARTMENTAL AND OTHER SUPPLIES.,,,"No, it does not 'cut
out local buying but simply provides that purchases shall be made by this commission. The question of where purchases should be made is a matter with which the commission deals. Provision is made in the Bill, as is necessary, that certain supplies may be purchased by the departments in small quantities or in case of emergency, which might arise in any section of the country. Just as in every well organized business where there is a central purchasing department, there must be a certain amount of latitude given to officials on the ground in the making of small or (emergency purchases, so provision is made ffor such purchases in this Bill. The Bill provides for the appointment of three commissioners to hold office for a period of ten years, and they shall cease to hold office on reaching the age of 70 years. A3 I have already intimated, the salaries are left blank, and that clause must stand
iMr. Rowell.]
until the resolution is submitted to the committee authorizing this expenditure. The main clause of the Bill defining the powers of the commission is section 6, which reads:
(1) The commission shall have the exclusive power and right to purchase, contract for, inspect and accept supplies for the public service. Provided, however, that the commission, when it deems it advisable, may, subject to such conditions as may be prescribed by regulation or by the commission, authorize any portion of the public service to purchase, contract for, inspect or accept supplies.
Members will see that the commission can make no purchase except upon requisition of the various departments. Under section 12 the departments must present requisitions showing the kind and quantity of supplies they require. The commission have no authority to change any such requisition, but if they feel that the requisition is not one which they should comply with or that for any other reason the attention of the Government should be drawn to it, they may communicate to the Prime Minister their observations on that requisition for such action as the Government may see fit to take in the premises.
Section 13, it will be seen, provides that estimates of the supplies required shall he made on or before such dates as may be prescribed by regulation and sent to the, commission. This will enable the commission to purchase at one time for several departments and in large quantities.
Section 16 requires that the purchases shall be by tender.
Section 17 provides that the commission shall keep full records and make such reports to the Prime Minister as he shall from time to time require.
In brief outline I have set forth the main provisions of the Bill, and I can only close as I opened: The object of the Bill is to secure the benefit of the purchase on a business basis, through one central organization, of all supplies required by the Government for public purposes, wholly free from party patronage or political influence, so that the Government will receive for every dollar expended a dollar's worth in return. Every citizen of Canada is interested in securing this result, and this Bill marks a great step in advance over the pre-war and early-war conditions.

",Unionist,,Newton Wesley Rowell,http://www.parl.gc.ca/parlinfo/Files/Parliamentarian.aspx?Item=a43fcba7-73d8-48ff-b457-5740c40cecab&Language=E&Section=ALL
536442,ca.proc.d.1919-06-06.9.18,1919-06-06,89103d9d-627c-4f56-8113-57b0d3865982,ca.m.3867,Mr. FIELDING:,,PURCHASING OF DEPARTMENTAL AND OTHER SUPPLIES.,,,"Well, are not the
Canadian NationaK railways a part of the public service of Canada? Wherein do they differ from any other branch of the public service?

",Unionist (Liberal),,William Stevens Fielding,http://www.parl.gc.ca/parlinfo/Files/Parliamentarian.aspx?Item=89103d9d-627c-4f56-8113-57b0d3865982&Language=E&Section=ALL
536427,ca.proc.d.1919-06-06.9.3,1919-06-06,a43fcba7-73d8-48ff-b457-5740c40cecab,ca.m.3293,Mr. ROWELL:,Minister presiding over the Department of Health; President of the Privy Council,PURCHASING OF DEPARTMENTAL AND OTHER SUPPLIES.,,,"This Order has been1
on the Paper for some time. My suggestion would be that we go on with the second reading and I will leave the Bill in the committee, leaving the clause that relates to the salaries of the commissioners open; in fact, I must do that because the resolution covering salaries must be passed before that can be dealt with. Under these circumstances, any discussion that members may wish to have upon it may be had on that section. We can go on with the Bill this afternoon and get through with the rest of it.

",Unionist,,Newton Wesley Rowell,http://www.parl.gc.ca/parlinfo/Files/Parliamentarian.aspx?Item=a43fcba7-73d8-48ff-b457-5740c40cecab&Language=E&Section=ALL
536428,ca.proc.d.1919-06-06.9.4,1919-06-06,61c189fb-d551-49ed-82da-cc777b86b056,ca.m.8432,Mr. BUREAU:,,PURCHASING OF DEPARTMENTAL AND OTHER SUPPLIES.,,,"Is it understood that the-principle of the Bill can be discussed on that particular section? I have been informed by a good many members that they desired to speak on the question.

",Laurier Liberal,,Jacques Bureau,http://www.parl.gc.ca/parlinfo/Files/Parliamentarian.aspx?Item=61c189fb-d551-49ed-82da-cc777b86b056&Language=E&Section=ALL
536429,ca.proc.d.1919-06-06.9.5,1919-06-06,5e8a24b4-f155-4f3d-aacc-e6da13c93756,ca.m.4254,Sir ROBERT BORDEN:,Prime Minister; Secretary of State for External Affairs,PURCHASING OF DEPARTMENTAL AND OTHER SUPPLIES.,,,"It is rather inconvenient to discuss the principle of a Bill in Committee. Are there many gen-tiemen away this afternoon?

",Unionist,,Robert Laird Borden,http://www.parl.gc.ca/parlinfo/Files/Parliamentarian.aspx?Item=5e8a24b4-f155-4f3d-aacc-e6da13c93756&Language=E&Section=ALL
536430,ca.proc.d.1919-06-06.9.6,1919-06-06,intervention,,,,PURCHASING OF DEPARTMENTAL AND OTHER SUPPLIES.,,,"A good many of them.

",,,Mr BUREAU:,
536431,ca.proc.d.1919-06-06.9.7,1919-06-06,5e8a24b4-f155-4f3d-aacc-e6da13c93756,ca.m.4254,Sir ROBERT BORDEN:,Prime Minister; Secretary of State for External Affairs,PURCHASING OF DEPARTMENTAL AND OTHER SUPPLIES.,,,"Why are they not here?

",Unionist,,Robert Laird Borden,http://www.parl.gc.ca/parlinfo/Files/Parliamentarian.aspx?Item=5e8a24b4-f155-4f3d-aacc-e6da13c93756&Language=E&Section=ALL
536432,ca.proc.d.1919-06-06.9.8,1919-06-06,61c189fb-d551-49ed-82da-cc777b86b056,ca.m.8432,Mr. BUREALT:,,PURCHASING OF DEPARTMENTAL AND OTHER SUPPLIES.,,,"I will tell my right hon. fiiend why. We are in a rather difficult position. We have to attend a little bit to our business. We have not obstructed the business of the House very much so far. It is known that Friday is an off day. We are practically all from the province

of Quebec on this side and we have some little work to do in the courts before the long vacation sets in.

",Laurier Liberal,,Jacques Bureau,http://www.parl.gc.ca/parlinfo/Files/Parliamentarian.aspx?Item=61c189fb-d551-49ed-82da-cc777b86b056&Language=E&Section=ALL
536433,ca.proc.d.1919-06-06.9.9,1919-06-06,5e8a24b4-f155-4f3d-aacc-e6da13c93756,ca.m.4254,Sir ROBERT BORDEN:,Prime Minister; Secretary of State for External Affairs,PURCHASING OF DEPARTMENTAL AND OTHER SUPPLIES.,,,"We will go on, and later we will endeavour to give an opportunity to hon. gentlemen to discuss the matter.

",Unionist,,Robert Laird Borden,http://www.parl.gc.ca/parlinfo/Files/Parliamentarian.aspx?Item=5e8a24b4-f155-4f3d-aacc-e6da13c93756&Language=E&Section=ALL
536434,ca.proc.d.1919-06-06.9.10,1919-06-06,61c189fb-d551-49ed-82da-cc777b86b056,ca.m.8432,Mr. BUREAU:,,PURCHASING OF DEPARTMENTAL AND OTHER SUPPLIES.,,,"If that is understood it is all right.

",Laurier Liberal,,Jacques Bureau,http://www.parl.gc.ca/parlinfo/Files/Parliamentarian.aspx?Item=61c189fb-d551-49ed-82da-cc777b86b056&Language=E&Section=ALL
536435,ca.proc.d.1919-06-06.9.11,1919-06-06,5e8a24b4-f155-4f3d-aacc-e6da13c93756,ca.m.4254,Sir ROBERT BORDEN:,Prime Minister; Secretary of State for External Affairs,PURCHASING OF DEPARTMENTAL AND OTHER SUPPLIES.,,,"Indeed, if there is any clause that is passed and there is a desire to reconsider it I do not think there would be any objection to going back to it even if it were formally passed.

",Unionist,,Robert Laird Borden,http://www.parl.gc.ca/parlinfo/Files/Parliamentarian.aspx?Item=5e8a24b4-f155-4f3d-aacc-e6da13c93756&Language=E&Section=ALL
536436,ca.proc.d.1919-06-06.9.12,1919-06-06,6c38f39b-1f70-4da5-ac6d-14d796590e55,ca.m.6574,Mr. McKENZIE:,Leader of the Official Opposition,PURCHASING OF DEPARTMENTAL AND OTHER SUPPLIES.,,,"Perhaps the minister would explain the Bill a little more?

",Laurier Liberal,,Daniel Duncan McKenzie,http://www.parl.gc.ca/parlinfo/Files/Parliamentarian.aspx?Item=6c38f39b-1f70-4da5-ac6d-14d796590e55&Language=E&Section=ALL
536437,ca.proc.d.1919-06-06.9.13,1919-06-06,a43fcba7-73d8-48ff-b457-5740c40cecab,ca.m.3293,Mr. ROWELL:,Minister presiding over the Department of Health; President of the Privy Council,PURCHASING OF DEPARTMENTAL AND OTHER SUPPLIES.,,,"The object of this
Bill is to continue the work which has been carried on during the greater part of the war period by the War Purchasing Commission. The intention of the Government is to make sure that in future the purchase of all supplies required by the various departments of the Government shall be made through a purchasing commission of business men with tenders called for from the business men of the country and wholly apart from personal or political influences. The members will recall that in May, 1915, an Order in Council was passed creating what was known as the War Purchasing Commission. The Order in Council provides that:
All purchases of clothing, equipment, arms, juns, ammunition, horses, munitions and materials of war and supplies of every kind, and all contracts for such purposes, and all contracts for transportation, payable out of the funds appropriated by the War Appropriation Act, 1915, or out of the funds appropriated by any other Act for the purpose enumerated in the War Appropriation Act, 1915, shall be made by the commission or made under its direction and control, and the commission is hereby empowered on behalf of the Government to make such purchases and to enter into or direct and control the making of such contracts.
Under that Order in Council Sir Edward Kemp, Mr., afterwards Sir, Hormisdas La-porte, and Mr. George Frederick Galt, of Winnipeg, were appointed members of this commission. The commission carried on its work of purchasing all war supplies and all supplies purchased out of the War Appropriation Fund, until the autumn of 1917, without any change in personnel. Sir Edward Kemp, upon being appointed Overseas Minister of Militia, resigned the chairmanship of the War Purchasing Commission and also resigned his membership in it. Sir Hormisdas Laporte was appointed chairman, and

Mr. W. P. Gundy, of Toronto, succeeded Sit Edward Kemp on the commission. The commission as reconstituted conducted its work under this original Order in Council without substantial change until the spring of 1918. In the month of February, 1918, the powers of the commission were enlarged so as to cover the purchasing in all departments of the Government, with the single exception of that of Government railways. An Order in 'Council was passed on the 6th February, 1918. The recital gives the reasons not only for the Order in 'Council, but also for the present legislation, so that I may be permitted to read one or two clauses from it:
And whereas the Prime Minister is of the opinion that the provisions of the above mentioned Orders in Council and the functions of the War Purchasing Commission might with advantage be extended to all purchases by the several departments of the Government for any purpose, whether connected with the prosecution of the war or otherwise, subject to the provisions hereinafter set forth:
And whereas the Prime Minister observes that the establishment of the War Purchasing Commission has resulted in a very great saving of public moneys, 'as well as in the abolition of patronage in respect of purchases for the war and it is important to extend this system as widely as possible, pending consideration of permanent provision for that purpose after fuller study and consideration of the problems involved.
Under the original Order in Council it was provided that purchases should be made by or under the direction and control of the commission. In carrying on the work the commission have acted under the latter part of this clause, viz.: the purchases have been made under the direction and control of the commission, with the results outlined by the Prime Minister in the recital to the Order in Council of February, 1918.
This commission was appointed for the period of the war and the members served in an honorary capacity. They have all given their services to the country without any compensation whatever, and I am sure the, members of the House will feel that the House owes an expression of appreciation to those public-spirited business men for the faithful and efficient service they have given to the country in this important branch of the public service. It is a matter of great regret to the Government, as I am sure it will be to the House, that one oi the members of the commission, Mr. Gundy, of Toronto, died very unexpectedly some ten days ago, while in the service of the country, and the commission has lost the benefit of his valuable services. He was deeply interested in the work of the com-

mission, and gave unstintedly of his splendid business ability in its service. So great was his devotion to his country and to his country's cause in the war, that 1 am sure if he had had the opportunity to choose the circumstances under which he would pass away, he would have chosen to die in the service of the country he loved and while working in the cause which lay so near to his heart.
The Bill provides for the creation of a Central Purchasing Commission under which in future the purchase of all supplies for the Government will be made. As I have pointed out, under the existing Orders in Council purchases were 'made under the direction and control of the commission and each department continued its existing purchasing staff. The commission did not consider it desirable to disturb the existing staffs, as the War Purchasing Commission was of a temporary character, and when it was formed they thought that probably when the war was over pre-war conditions would again prevail. But now that it has been decided to make the War Purchasing Commission a permanent organization, there is no longer any reason for maintaining the existing staffs of all the departments, and the object of the Bill is to centralize the purchasing for all the branches of the Government in one purchasing commission. The members of the House know that all great business concerns of the present day have long since centralized their purchasing in order to obtain the very best results for 'the moneys expended. Some of the benefits that will result from centralized purchasing in such a business body as this will be, first, that instead of purchasing a certain quantity of supplies for one department, this Purchasing Commission will ascertain from all the departments the total quantities of supplies of any given article which they require and will thus be able in one purchase to secure all the articles of any given class which all the branches of the Government may require. In purchasing under these conditions the commission should, and no doubt will, obtain in many cases all the desired supplies at a lower price than would be possible in the purchase of smaller quantities by different departments. There will be an advantage in having a body oi men devoting their whole attention to the business of purchasing Government supplies. Purchasing to-day has become almost a science in the large business concerns of the country. Men of the highest ability are appointed to this responsible task in order that the institutions with
which they are connected may obtain the benefit of their skill and ability. In making purchases in this way the Government will have the benefit of a thoroughly efficient organization. I am sure that members of the House will be interested to know what the total purchases of the Government amount to from year to year. During the past two or three years purchases have, of course, been enormous. Purchasing under normal conditions would not be on as large a scale as during the war years. But it must also be borne in mind that during the war years the purchase of supplies for many departments has been on a very limited scale. Some departments have been keeping the purchase of supplies down to the lowest limit and when normal conditions return the volume of supplies required by these branches of the Government will be substantially larger than the volume required during the period of the war. The estimate of the commission is that the annual purchases for the Government will be not less than $40,000,000. They have been much more than that during the war period.

",Unionist,,Newton Wesley Rowell,http://www.parl.gc.ca/parlinfo/Files/Parliamentarian.aspx?Item=a43fcba7-73d8-48ff-b457-5740c40cecab&Language=E&Section=ALL
536459,ca.proc.d.1919-06-06.9.35,1919-06-06,a43fcba7-73d8-48ff-b457-5740c40cecab,ca.m.3293,Mr. ROWELL:,Minister presiding over the Department of Health; President of the Privy Council,PURCHASING OF DEPARTMENTAL AND OTHER SUPPLIES.,,,"The Bill does not affect
that question at all. It provides for the purchasing through one central commission.
Mr! COCKSHUTT: By tender?

",Unionist,,Newton Wesley Rowell,http://www.parl.gc.ca/parlinfo/Files/Parliamentarian.aspx?Item=a43fcba7-73d8-48ff-b457-5740c40cecab&Language=E&Section=ALL
536460,ca.proc.d.1919-06-06.9.36,1919-06-06,a43fcba7-73d8-48ff-b457-5740c40cecab,ca.m.3293,Mr. ROWELL:,Minister presiding over the Department of Health; President of the Privy Council,PURCHASING OF DEPARTMENTAL AND OTHER SUPPLIES.,,,"And the principal of tender will apply. Does my hon. friend object to that principle?

",Unionist,,Newton Wesley Rowell,http://www.parl.gc.ca/parlinfo/Files/Parliamentarian.aspx?Item=a43fcba7-73d8-48ff-b457-5740c40cecab&Language=E&Section=ALL
536465,ca.proc.d.1919-06-06.9.41,1919-06-06,a43fcba7-73d8-48ff-b457-5740c40cecab,ca.m.3293,Mr. ROWELL:,Minister presiding over the Department of Health; President of the Privy Council,PURCHASING OF DEPARTMENTAL AND OTHER SUPPLIES.,,,"I have already explained that. Under the powers given by this Bill there is authority in the commission to authorize-and the War Purchasing Commission has authorized in the past, and the new commission will undoubtedly authorize in the future-the purchase of small quantities of local supplies by the person in charge, just as any purchasing agent in any organization would do.

",Unionist,,Newton Wesley Rowell,http://www.parl.gc.ca/parlinfo/Files/Parliamentarian.aspx?Item=a43fcba7-73d8-48ff-b457-5740c40cecab&Language=E&Section=ALL
536466,ca.proc.d.1919-06-06.9.42,1919-06-06,0b65ff12-9c90-415b-937f-308e67da151a,ca.m.8159,Mr. BURNHAM:,,PURCHASING OF DEPARTMENTAL AND OTHER SUPPLIES.,,,"Will the minister compare this system with the old system? Because if that is all there is in it we will be able to understand it better.

",Unionist,,John Hampden Burnham,http://www.parl.gc.ca/parlinfo/Files/Parliamentarian.aspx?Item=0b65ff12-9c90-415b-937f-308e67da151a&Language=E&Section=ALL
536472,ca.proc.d.1919-06-06.9.48,1919-06-06,c1b69015-0348-4ed6-8d8a-3de18e5d1742,ca.m.2824,Sir SAM HUGHES:,,PURCHASING OF DEPARTMENTAL AND OTHER SUPPLIES.,,,"How far would the minister of a department have authority to deal with this commission?

",Unionist,,Samuel Hughes,http://www.parl.gc.ca/parlinfo/Files/Parliamentarian.aspx?Item=c1b69015-0348-4ed6-8d8a-3de18e5d1742&Language=E&Section=ALL
