basepk,hid,speechdate,pid,opid,speakeroldname,speakerposition,maintopic,subtopic,subsubtopic,speechtext,speakerparty,speakerriding,speakername,speakerurl
536611,ca.proc.d.1919-06-06.13.64,1919-06-06,a43fcba7-73d8-48ff-b457-5740c40cecab,ca.m.3293,Mr. ROWELL:,Minister presiding over the Department of Health; President of the Privy Council,PURCHASING OF DEPARTMENTAL AND OTHER SUPPLIES.,,,"I think so. It provides
that they may be transferred from any other portion of the public service. I will consider it further, if the hon. member desires.

",Unionist,,Newton Wesley Rowell,http://www.parl.gc.ca/parlinfo/Files/Parliamentarian.aspx?Item=a43fcba7-73d8-48ff-b457-5740c40cecab&Language=E&Section=ALL
536728,ca.proc.d.1919-06-06.13.181,1919-06-06,733cae8a-7e57-46c6-ab2e-478ac991835f,ca.m.4942,Mr. LEMIEUX:,,PURCHASING OF DEPARTMENTAL AND OTHER SUPPLIES.,,,"I move that this section be allowed to stand.

",Laurier Liberal,,Rodolphe Lemieux,http://www.parl.gc.ca/parlinfo/Files/Parliamentarian.aspx?Item=733cae8a-7e57-46c6-ab2e-478ac991835f&Language=E&Section=ALL
536732,ca.proc.d.1919-06-06.13.185,1919-06-06,d98b30ab-759a-4b5e-b3ba-420ce11b08d2,ca.m.9083,Mr. J. H. SINCLAIR:,,PURCHASING OF DEPARTMENTAL AND OTHER SUPPLIES.,,,"The practice has become prevalent of dispensing with public advertisement in many cases. A department professes to know the number of people who deal in certain articles in some province or vicinity, and instead of calling for tenders by public advertisement they send a circular letter or notice to the dealers. If this can be done in a fair way the practice is satisfactory. But the difficulty is that certain names are omitted from the list in the department and complaints are frequently made, as they were in the case of the War Purchasing Commission, that certain people did not get these notices. It should be easy to provide that in cases of this kind merchants or dealers could send in their names and post office addresses and be entitled to the usual notice.

",Laurier Liberal,,John Howard Sinclair,http://www.parl.gc.ca/parlinfo/Files/Parliamentarian.aspx?Item=d98b30ab-759a-4b5e-b3ba-420ce11b08d2&Language=E&Section=ALL
536565,ca.proc.d.1919-06-06.13.17,1919-06-06,deaf5a4f-d8a1-49b8-a81b-f90eeaf06463,ca.m.9018,Mr. McMASTER:,,PURCHASING OF DEPARTMENTAL AND OTHER SUPPLIES.,,,"The great and main objection to the Bill is that it takes away from the ministers the responsibility which they should assume for the prices paid for the things that are bought for the public service. I have no more to say. I believe the whole subject is summed up by these few remarks. Perhaps the minister who preceded-me will at least absolve me from any of the strictures he may in the future make in regard to the length of speeches on this side of the House.

",Laurier Liberal,,Andrew Ross McMaster,http://www.parl.gc.ca/parlinfo/Files/Parliamentarian.aspx?Item=deaf5a4f-d8a1-49b8-a81b-f90eeaf06463&Language=E&Section=ALL
536457,ca.proc.d.1919-06-06.9.33,1919-06-06,a43fcba7-73d8-48ff-b457-5740c40cecab,ca.m.3293,Mr. ROWELL:,Minister presiding over the Department of Health; President of the Privy Council,PURCHASING OF DEPARTMENTAL AND OTHER SUPPLIES.,,,"I have no knowledge of the particular transaction my hon. friend refers to. But I do know the commission has been at great pains to ascertain that the tenders accepted represented good value for the prices paid. Of course, it cannot make tenders come in; all it can do is to require that tenders shall be presented, and it proceeds on the basis of accepting the lowest tender. There may have been some cases where the commission called for further tenders or endeavoured to get lower prices by reason of the first tender being excessive. I am sure that any member who looks into the work of the commission will be satisfied that it has rendered a very conspicuous piece of public service ever since it was inaugurated.

",Unionist,,Newton Wesley Rowell,http://www.parl.gc.ca/parlinfo/Files/Parliamentarian.aspx?Item=a43fcba7-73d8-48ff-b457-5740c40cecab&Language=E&Section=ALL
536625,ca.proc.d.1919-06-06.13.78,1919-06-06,a43fcba7-73d8-48ff-b457-5740c40cecab,ca.m.3293,Mr. ROWELL:,Minister presiding over the Department of Health; President of the Privy Council,PURCHASING OF DEPARTMENTAL AND OTHER SUPPLIES.,,,"I think, 33. All who have been appointed to the staff since the early part of 1918, when the Civil Service Commission was given jurisdiction over them, have been appointed on the recommendation of the Civil Service Commission and have passed whatever examination was required. I cannot tell how many are in one class and how many in another. They advertised for two or three men to do a particular class of work and I think they had 792 applications for these positions. They secured, I believe, two very efficient men, but it indicates there were a large number willing to serve.

",Unionist,,Newton Wesley Rowell,http://www.parl.gc.ca/parlinfo/Files/Parliamentarian.aspx?Item=a43fcba7-73d8-48ff-b457-5740c40cecab&Language=E&Section=ALL
536483,ca.proc.d.1919-06-06.9.59,1919-06-06,0b65ff12-9c90-415b-937f-308e67da151a,ca.m.8159,Mr. J. H. BURNHAM (West Peterborough) :,,PURCHASING OF DEPARTMENTAL AND OTHER SUPPLIES.,,,"I should like to draw the attention of the minister to a little incident which will serve as an illustration of something that has happened very frequently, and may happen much more frequently, very much to the detriment of the member for a constituency. Under the old system it used to be known that tenders for coal were required. Now this Bill does not apply to the wthole system of tendering. Consequently, there is just as much room for inefficiency and for doing evil that there was before. There is no way under Heaven by which business can be properly done if you cannot rely on the honesty of the people doing it. Let me give an instance. Instructions were sent to a janitor to find out how much coal was required, and what the price, would be. He did so, but instead of asking several people what their tenders would be, he asked only one man, and he sent that man's tender to Ottawa. It was accepted, and then the people rose up on their hind * legs and said "" What sort of a member of Parliament are you to allow such work
as this to go on?"" I said "" I, did not do it."" "" Oh, yes, they said, that won't go here. You are the member for this constituency and must watch the Government in everything. You must look into this matter."" So having ascertained the facts, I communicated with the Minister of Public Works, and in due time he communicated with the officer he had employed at Peterborough, one of his own officers, and found I had stated the matter correctly. I said to the Minister of Public Works "" What are you going to do about it? This man is perfectly honest. I do not think he intended to do anything wrong, but the efficiency of your system is now on trial. What are you going to do?"" He replied "" I will have to fine him five dollars."" So the Minister of Public Works fined his own agent in Peterborough for inefficiency in a transaction under this brand-new system which the member had nothing to do with, but which he will' have to watch very carefully.

",Unionist,,John Hampden Burnham,http://www.parl.gc.ca/parlinfo/Files/Parliamentarian.aspx?Item=0b65ff12-9c90-415b-937f-308e67da151a&Language=E&Section=ALL
536489,ca.proc.d.1919-06-06.9.65,1919-06-06,fec8fb76-539a-4343-9bea-79ced68f163b,ca.m.6654,Mr. E. W. NESBITT (Oxford North):,,PURCHASING OF DEPARTMENTAL AND OTHER SUPPLIES.,,,"I am sorry I was not in the House when the minister who has charge of the Bill (Mr. Rowell) gave his explanation of the measure. I have been reading the Bill and I cannot understand the necessity for three commissioners to purchase the supplies for the departments of this Government. I will guarantee to supply them with a man who, if he is furnished with a good, clever stenographer and one or two inspectors, will purchase all the supplies that the Government will require in a year and who, even then will not be any busier than the purchaser for any large institution in this country. Referring to clause 5, I find that the Governor in Council may appoint an officer to be called the director of the Purchasing Commission for Canada. What is he going to do? Is he going to direct the commission how to purchase? As I understand it, the deputy minister, or some other head of a department, may put in a request for supplies and the commission will purchase them. I suppose this director will direct them how to purchase the supplies.

",Unionist,,Edward Walter Nesbitt,http://www.parl.gc.ca/parlinfo/Files/Parliamentarian.aspx?Item=fec8fb76-539a-4343-9bea-79ced68f163b&Language=E&Section=ALL
536491,ca.proc.d.1919-06-06.9.67,1919-06-06,fec8fb76-539a-4343-9bea-79ced68f163b,ca.m.6654,Mr. NESBITT:,,PURCHASING OF DEPARTMENTAL AND OTHER SUPPLIES.,,,"And where. I do not know what else it can mean. I believe that under the present system there is a waste in purchasing for the Government departments, This will mean not merely three commissioners; a whole department will be built up with forty or fifty clerks, stenographers and so on. It will run into a department and a very expensive one. We want to economize. That is what we were told to do yesterday, and by the looks of the financial statement, it is necessary not only as a people but as a Government. I see no economy in this Bill as introduced. I am sorry I did not hear the minister's explanation for it. There may be a reason for it. I understand there is a great deal of waste in the purchasing of supplies by the different departments. This new department will require, I suppose, a lot of typewriters. There are.plenty of typewriters in the different departments that are not in use, but this new department will not have any old typewriters; they will insist on having new typewriters, new furniture, new stationery, almost everything new, and they will not under any possibility gather up equipment that might have been used by commissions and departments that have been abolished. There is no necessity for waste in purchasing if it is properly conducted. Why we want three commissioners to do the purchasing when one man could easily do it, is more than I can comprehend; besides which there is to be another man who is to be called the Director of the Commission. I see no sense in the Bill at all.

",Unionist,,Edward Walter Nesbitt,http://www.parl.gc.ca/parlinfo/Files/Parliamentarian.aspx?Item=fec8fb76-539a-4343-9bea-79ced68f163b&Language=E&Section=ALL
536506,ca.proc.d.1919-06-06.9.82,1919-06-06,c50a19e3-39f9-41dc-ad93-47002215b3d6,ca.m.6120,Hon. J. A. CALDER (Minister of Immigration and Colonization):,Minister of Immigration and Colonization,PURCHASING OF DEPARTMENTAL AND OTHER SUPPLIES.,,,"In the Bill
which was before this House amending the Immigration Act certain persons who advocated the overthrow of government, the destruction of property, and so on, by violence were in the prohibited classes. The matter has been inquired into further and the law officers of the Crown have advised that the section as it stands does not really cover all that was intended.

",Unionist,,James Alexander Calder,http://www.parl.gc.ca/parlinfo/Files/Parliamentarian.aspx?Item=c50a19e3-39f9-41dc-ad93-47002215b3d6&Language=E&Section=ALL
536550,ca.proc.d.1919-06-06.13.2,1919-06-06,5e8a24b4-f155-4f3d-aacc-e6da13c93756,ca.m.4254,Sir ROBERT BORDEN:,Prime Minister; Secretary of State for External Affairs,PURCHASING OF DEPARTMENTAL AND OTHER SUPPLIES.,,,"I had so nearly finished what I purposed saying that it seems hardly worth while to resume, but perhaps it would be desirable to present
to the House the considerations set forth in the report of the War Purchasing Commission, to which report I have already alluded. The disadvantages of the methods which have prevailed in the past were presented to us in this way:
The need for centralization is clearly demonstrated 'by the numerous disadvantages of the present arrangements under which each department makes its own purchases, subject to approval of the War Purchasing' Commission. Some of these disadvantages may be stated as follows:
(a)	Each department is now buying supplies in utter ignorance of what the others are doing.
(b)	The departments generally do not get the benefit of the technical knowledge and experience acquired in each department.
(c)	The quantity of goods required by some of the departments is not sufficient to enable them to purchase at the best prices.
< d) When high prices prevail, owing to shortage of material, this condition is aggravated by competition amongst the Government departments themselves.
(e)	There is a lack of uniformity of specifications and also of inspection.
(f)	Large volume of emergency orders resulting in higher costs and giving opportunity for irregularities and * complaints arising therefrom.
(g)	There is a deplorable lack in the departments of study of market conditions, revisions of specifications, et cetera.
The report continues:
That co-ordination in Government buying would do much to remove or lessen the disadvantages of the present methods is beyond question. Enquiry shows that while each department may require certain supplies which are peculiar to its special needs, yet the larger proportion of the total outlay is for goods common to several departments. If the requirements in a particular line, instead of being ordered separately by each department, were bought collectively by a central purchasing office with its stall of experts for each class of goods, the larger quantities ordered, the elimination of competition among the departments, the decrease in emergency purchases, the adoption of uniform specifications and methods of inspection, and the many other improvements which would be possible would result in an enormous saving of money, and still further remove any temptations to personal favouritism which may now exist or tend to creep in in the future.
Some reference was made this afternoon to the possibility of delay through waiting for the action of a Central Purchasing Commission in respect- of small supplies required by departments of the Government in different- parts of the country. That subject has been under consideration. It was dealt with by a provision in the Order in Council, and as to emergency purchases of that character-small purchases urgently required and as to which it would be quite undesirable to go to the expense of advertising for tenders-there is no reason why these

",Unionist,,Robert Laird Borden,http://www.parl.gc.ca/parlinfo/Files/Parliamentarian.aspx?Item=5e8a24b4-f155-4f3d-aacc-e6da13c93756&Language=E&Section=ALL
536544,ca.proc.d.1919-06-06.11.1.2,1919-06-06,5e8a24b4-f155-4f3d-aacc-e6da13c93756,ca.m.4254,Sir ROBERT BORDEN:,Prime Minister; Secretary of State for External Affairs,PRIVATE BILLS.,CANADIAN PACIFIC RAILWAY.,,"This is merely the substitution of the word "" may "" for the word "" shall "" with respect to the construction of that portion of the line west of Lloydminster. The Bill, as passed by this House, declared that:-
The approval of the route shall be made subject to joint construction or operation with the Canadian Northern Railway Company.
The Senate have changed the word "" shall "" to "" may,"" but in the event of disagreement the matter rests on terms to be settled by the Board of Railway Commissioners.
Mr. IMIlDDLBBRO: When this Bill was before the Railway Committee I moved that the word "" may "" be replaced by the word "" shall."" My object in doing so was to ensure that it would be necessary to get the consent of the railway commissioners. The word [DOT]"" may,"" I thought, would permit the parties to get together and thus avoid the

necessity of getting the consent of the board. A vote was taken in the committee and my amendment was carried. The Senate has now put the matter in the same form as it was before. All that I am desirous of ensuring by my amendment is that there should not be unnecessary duplication of lines, and, therefore, no unnecessary money expended in that manner. I would suggest that the amendment be not accepted by the committee.

",Unionist,,Robert Laird Borden,http://www.parl.gc.ca/parlinfo/Files/Parliamentarian.aspx?Item=5e8a24b4-f155-4f3d-aacc-e6da13c93756&Language=E&Section=ALL
536553,ca.proc.d.1919-06-06.13.5,1919-06-06,733cae8a-7e57-46c6-ab2e-478ac991835f,ca.m.4942,Mr. LEMIEUX:,,PURCHASING OF DEPARTMENTAL AND OTHER SUPPLIES.,,,"of some outside influences? It is as a Britisher that I appeal to my hon. friend; that I say to him that the war is oveT; that the time for extraordinary measures has passed; that we must resume parliamentary Government-democratic Government. The country has suffered immensely during the war; has endured sacrifices of blood and of money. It is the expectation of the country, therefore, that the era which is now opening up may be a truly democratic era. I hope that, having heard the strong protests not only from this side of the House, but from the other side as well-protests from independent members of the House-the Government will yield,^ or that they will think twice before insisting that this commission be created.
Once more I say that I do not at all criticize the members of this commission. I knew Mr. Gundy by reputation only; it was of the highest. I know personally^ Sir Hormisdas Laporte; there is no better citizen in Canada. But it is against the principle- the vicious, the autocratic principle-that I raise my voice this evening.
I said a moment ago that I had no English blood coursing through my veins. But I have the inherent logic of the French people; therefore, having regard to the protest which I have offered against this legislation, I must conclude logically. I therefore move, seconded by Mtr. J. H. iSinclair:
That this Bill he not now read the seeond time, but this day six months.

",Laurier Liberal,,Rodolphe Lemieux,http://www.parl.gc.ca/parlinfo/Files/Parliamentarian.aspx?Item=733cae8a-7e57-46c6-ab2e-478ac991835f&Language=E&Section=ALL
536613,ca.proc.d.1919-06-06.13.66,1919-06-06,a43fcba7-73d8-48ff-b457-5740c40cecab,ca.m.3293,Mr. ROWELL:,Minister presiding over the Department of Health; President of the Privy Council,PURCHASING OF DEPARTMENTAL AND OTHER SUPPLIES.,,,"I think there are at present, in all the departments and the commission combined, in the neighbourhood of 300 of these officers, if you include purchasing, inspecting and receiving staffs. It would not be feasible nor desirable to transfer them all, because in every department you must have some one to do the requisitioning and receive the supplies. So a certain number would remain in each department; I do not know how many; that is a matter to be arranged between the minister of the department and the commission. The others would be available for transfer to the new commission. I would anticipate that when the commission is fully organized the great majority of those in the different purchasing staffs of the various departments will be transferred to the commission. I think it is only a matter of fair dealing that men in the public service should not have their positions cut away by legislation without some effort being made to provide them with suitable positions. Under those conditions I would anticipate that a reduction in the staff would take place when men retired from it or were transferred to some other department of the Government and those vacancies were not filled. I do not think we coul'd anticipate an immediate reduction, but I would anticipate an early reduction in the total number. I do not anticipate any increase at 'all.

",Unionist,,Newton Wesley Rowell,http://www.parl.gc.ca/parlinfo/Files/Parliamentarian.aspx?Item=a43fcba7-73d8-48ff-b457-5740c40cecab&Language=E&Section=ALL
536621,ca.proc.d.1919-06-06.13.74,1919-06-06,a43fcba7-73d8-48ff-b457-5740c40cecab,ca.m.3293,Mr. ROWELL:,Minister presiding over the Department of Health; President of the Privy Council,PURCHASING OF DEPARTMENTAL AND OTHER SUPPLIES.,,,"No, it would not. Of
course, we cannot prevent the department from sending in any information it wishes with the requisition, but that is no part of the requisition. Forms are supplied on which the department states its requirements, and then the commission makes the purchases.

",Unionist,,Newton Wesley Rowell,http://www.parl.gc.ca/parlinfo/Files/Parliamentarian.aspx?Item=a43fcba7-73d8-48ff-b457-5740c40cecab&Language=E&Section=ALL
536642,ca.proc.d.1919-06-06.13.95,1919-06-06,733cae8a-7e57-46c6-ab2e-478ac991835f,ca.m.4942,Mr. LEMIEUX:,,PURCHASING OF DEPARTMENTAL AND OTHER SUPPLIES.,,,"Will the minister explain the signification of the expression "" right to purchase ""? My hon. friend from Antigonish and Guysborough (Mr. Sinclair) said a moment ago that before the Public Accounts Committee it was established there was an officer with the King's Printer whose duty it w.as to distribute advertisements to the press throughout Canada. Advertisements given by the Government to the press constitute a purchase of space. Will this express ""right to purchase "" include that purchase? Some days ago, whilst discussing the Post Office Department, I suggested to my hon. friend that the Government should put an end to the policy of wide advertising in such cases as mail contracts, and I gave some concrete instances. It came to my knowledge last

year that a weekly paper published in the county of Drummond and Arthabaska had notices of tenders for mail contracts to be awarded in the province of British Columbia. This is a pure waste of money, and the commission should have power to direct the purchase of space in the press. If the minister will assure me that this expression, "" right to purchase,"" covers the purchase of space in the newspapers for advertising purposes I have nothing more to say.

",Laurier Liberal,,Rodolphe Lemieux,http://www.parl.gc.ca/parlinfo/Files/Parliamentarian.aspx?Item=733cae8a-7e57-46c6-ab2e-478ac991835f&Language=E&Section=ALL
536652,ca.proc.d.1919-06-06.13.105,1919-06-06,a43fcba7-73d8-48ff-b457-5740c40cecab,ca.m.3293,Mr. ROWELL:,Minister presiding over the Department of Health; President of the Privy Council,PURCHASING OF DEPARTMENTAL AND OTHER SUPPLIES.,,,"That was intended to
cover such small purchases as have been mentioned. I intend to amend that clause by making it a little more specific. I therefore move to amend the clause, first, by striking out in the fifth and sixth lines the words ""or by the commission,"" and by adding at the end of the first paragraph of the said clause the words, ""of small value or quantity or of special character."" So that the first paragraph would then read as follows:
The commission shall have the exclusive power and right to purchase, contract for, inspect and accept supplies for the public service. Provided, however, that the commission, when it deems it advisable, may, subject to such conditions as may be prescribed by regulation, authorize any portion of the public service to purchase, contract for, inspect or accept supplies of small-value or quantity or of special character.

",Unionist,,Newton Wesley Rowell,http://www.parl.gc.ca/parlinfo/Files/Parliamentarian.aspx?Item=a43fcba7-73d8-48ff-b457-5740c40cecab&Language=E&Section=ALL
536666,ca.proc.d.1919-06-06.13.119,1919-06-06,a43fcba7-73d8-48ff-b457-5740c40cecab,ca.m.3293,Mr. ROWELL:,Minister presiding over the Department of Health; President of the Privy Council,PURCHASING OF DEPARTMENTAL AND OTHER SUPPLIES.,,,"It is not limited. There will be no objection to a limitation. It is intended to proceed with the organization just as rapidly as possible, and this amend-

ment is to avoid congestion during organization.

",Unionist,,Newton Wesley Rowell,http://www.parl.gc.ca/parlinfo/Files/Parliamentarian.aspx?Item=a43fcba7-73d8-48ff-b457-5740c40cecab&Language=E&Section=ALL
536716,ca.proc.d.1919-06-06.13.169,1919-06-06,a43fcba7-73d8-48ff-b457-5740c40cecab,ca.m.3293,Mr. ROWELL:,Minister presiding over the Department of Health; President of the Privy Council,PURCHASING OF DEPARTMENTAL AND OTHER SUPPLIES.,,,"Substantially so. My hon. friend is speaking in a very general way but, as applied to this Bill, I agree. That is one of the objects of this provision. The minister must take responsibility for the requisition. The commission cannot change it by its own action. The commission can report to the Prime Minister and the Prime Minister and Council, having the report of the commission, will decide if the requisition is all right and, if so, the commission will have to go ahead and' purchase. But if, upon the report of the' Prime Minister, that requisition should be reconsidered, the minister reconsiders it, and submits some other requisition and the purchase is made on that basis.

",Unionist,,Newton Wesley Rowell,http://www.parl.gc.ca/parlinfo/Files/Parliamentarian.aspx?Item=a43fcba7-73d8-48ff-b457-5740c40cecab&Language=E&Section=ALL
536678,ca.proc.d.1919-06-06.13.131,1919-06-06,a43fcba7-73d8-48ff-b457-5740c40cecab,ca.m.3293,Mr. ROWELL:,Minister presiding over the Department of Health; President of the Privy Council,PURCHASING OF DEPARTMENTAL AND OTHER SUPPLIES.,,,"What I said was that that question would come up for consideration properly under paragraph (d) of section 2, the interpretation clause, which stands over for further consideration. When that comes up the matter will be further considered.

",Unionist,,Newton Wesley Rowell,http://www.parl.gc.ca/parlinfo/Files/Parliamentarian.aspx?Item=a43fcba7-73d8-48ff-b457-5740c40cecab&Language=E&Section=ALL
