basepk,hid,speechdate,pid,opid,speakeroldname,speakerposition,maintopic,subtopic,subsubtopic,speechtext,speakerparty,speakerriding,speakername,speakerurl
536635,ca.proc.d.1919-06-06.13.88,1919-06-06,a43fcba7-73d8-48ff-b457-5740c40cecab,ca.m.3293,Mr. ROWELL:,Minister presiding over the Department of Health; President of the Privy Council,PURCHASING OF DEPARTMENTAL AND OTHER SUPPLIES.,,,"We shall transfer such persons as are recommended by the commission with the consent of the Civil Service Commission. No one can be transferred except on those two conditions: (1) *the recommendation of the new commission, and (2) the consent of the Civil Service 'Commission.

",Unionist,,Newton Wesley Rowell,http://www.parl.gc.ca/parlinfo/Files/Parliamentarian.aspx?Item=a43fcba7-73d8-48ff-b457-5740c40cecab&Language=E&Section=ALL
536636,ca.proc.d.1919-06-06.13.89,1919-06-06,6c38f39b-1f70-4da5-ac6d-14d796590e55,ca.m.6574,Mr. McKENZIE:,Leader of the Official Opposition,PURCHASING OF DEPARTMENTAL AND OTHER SUPPLIES.,,,"I can readily understand that a person who is a civil servant in a regular department can be transferred 'to this commission. But if a person has been employed by this temporary commission and the commission is dissolved, I submit, his relation to the service of the 'Commission and the Government is dissolved with it, and that he is no more ar officer of the Government than if he had inever been in its employ at all. I do not think it is the idea of the Civil Service Commission that you can take that man, without advertising for help, and plant him in a permanent position under this statute. This is a new staff and you have to get from ffhe outside, over and above the men that :may be transferred from a permanent department, the employees that you require; you must ask for them in the regular way and they must be advertised for and selected by 'the Civil Service Commission,
I do not admit that temporary employment by a temporary commission gives to an employee, under the law, the right to be transferred.

",Laurier Liberal,,Daniel Duncan McKenzie,http://www.parl.gc.ca/parlinfo/Files/Parliamentarian.aspx?Item=6c38f39b-1f70-4da5-ac6d-14d796590e55&Language=E&Section=ALL
536656,ca.proc.d.1919-06-06.13.109,1919-06-06,a43fcba7-73d8-48ff-b457-5740c40cecab,ca.m.3293,Mr. ROWELL:,Minister presiding over the Department of Health; President of the Privy Council,PURCHASING OF DEPARTMENTAL AND OTHER SUPPLIES.,,,"That would not he ""of
small value."" On the suggestion of my hon. friend the Acting Minister of Trade and Commerce, I have added - the words ""or quantity,"" so that it limits the proviso in that way.

",Unionist,,Newton Wesley Rowell,http://www.parl.gc.ca/parlinfo/Files/Parliamentarian.aspx?Item=a43fcba7-73d8-48ff-b457-5740c40cecab&Language=E&Section=ALL
536667,ca.proc.d.1919-06-06.13.120,1919-06-06,d98b30ab-759a-4b5e-b3ba-420ce11b08d2,ca.m.9083,Mr. J. H. SINCLAIR:,,PURCHASING OF DEPARTMENTAL AND OTHER SUPPLIES.,,,"What department does the commission report to?

",Laurier Liberal,,John Howard Sinclair,http://www.parl.gc.ca/parlinfo/Files/Parliamentarian.aspx?Item=d98b30ab-759a-4b5e-b3ba-420ce11b08d2&Language=E&Section=ALL
536673,ca.proc.d.1919-06-06.13.126,1919-06-06,a43fcba7-73d8-48ff-b457-5740c40cecab,ca.m.3293,Mr. ROWELL:,Minister presiding over the Department of Health; President of the Privy Council,PURCHASING OF DEPARTMENTAL AND OTHER SUPPLIES.,,,"I must express my surprise at the remarks of my hon. friend. I think, however, there is one obvious interpretation of them. He has been trying to argue himself into the belief that he did not put his party in an entirely false position when he opposed this Bill. He has introduced many other subjects into the discussion of this clause; I shall not follow him in them all. As to the Civil Service, that can be discussed when we reach the Bill dealing with that matter. I shall not follow him on the Military Service Act; it is not germane to the present discussion, but I may say at least that the statement he made, is, of course, quite without foundation. But coming to the subject under discussion, I say to my hon. friend that there is no political patronage in connection with the purchases made by this commission. If he thinks there is, he has the opportunity of endeavouring to establish that belief before the Public Accounts Committee. If the name of any man producing any particular line of goods is furnished to this commission, the commission will ask him to notify them of all the goods that he handles, and he will have exactly the same opportunity to tender as every other person has. The commission has endeavoured to secure the best list that could be secured of men engaged in various lines of industry and dealing in various kinds of commodities, in order that they may receive notification of the supplies which the Government wishes to purchase, and in order that they may put in a tender if they wish to do so.
I am quite sure my hon. friend has not taken to heart what the hon. member for Maisonneuve (Mr. Lemieux) said with reference to the chairman of the commission, Sir Hormisdas Laporte, or Mr. Gundy, or Mr. Galt. Those men have not lent themselves to political party patronage, but they have carried on the business in an honesit, straightforward way. This commission is-doing .so and will continue to do so, notwithstanding the remarks of my hon. friend.

",Unionist,,Newton Wesley Rowell,http://www.parl.gc.ca/parlinfo/Files/Parliamentarian.aspx?Item=a43fcba7-73d8-48ff-b457-5740c40cecab&Language=E&Section=ALL
536674,ca.proc.d.1919-06-06.13.127,1919-06-06,6c38f39b-1f70-4da5-ac6d-14d796590e55,ca.m.6574,Mr. McKENZIE:,Leader of the Official Opposition,PURCHASING OF DEPARTMENTAL AND OTHER SUPPLIES.,,,"If the minister thinks I am looking for an excuse for leading the party on this side of the House to vote against the Bill, I require no such excuse, and if the minister thinks I was wrong, how how does he account for so .many strong protests from his side of the House? I venture to think that if hon. gentlemen opposite were free from party entanglements and obligations, this Bill would never go through the House. Some of the very best men sitting behind the minister have spoken against the Bill, saying that the commission was not necessary and that it involved a further expense when every dollar should be carefully conserved.
We have at present a committee of members of this House inquiring as to where we can cut down the Civil Service. They say that everything is overlapping; thait we have ten to every one that we require in the Civil Service. Those are the statements that are made. I do not know whether they are true or not. We have also a commission to which we have paid hundreds of thousands of dollars to find out where we could weed out and cut down the Civil Service. In the midst of all this the minister comes here to create a new department in which at the first flash he is to put 300 men for whom he is creating a home. He admits there is no work for them, because

he says this commission is _ being created for the purpose of cutting down work. Then he is appointing a director over them, and there is no telling how many are to be added to this new department of the Civil Service. Yet I am to be told by the President of the Council that I am afraid of my own action and the action of the Opposition in this House because we are opposed to the creation of a new department and the further involving of the people of this country in the unnecessary expenditure of millions of dollars year after year. If that is all that I have any reason to be afraid of, or if that is the only mistake I have made in my position as leader, I have very little to fear from the judgment of the people.

",Laurier Liberal,,Daniel Duncan McKenzie,http://www.parl.gc.ca/parlinfo/Files/Parliamentarian.aspx?Item=6c38f39b-1f70-4da5-ac6d-14d796590e55&Language=E&Section=ALL
536680,ca.proc.d.1919-06-06.13.133,1919-06-06,733cae8a-7e57-46c6-ab2e-478ac991835f,ca.m.4942,Mr. LEMIEUX:,,PURCHASING OF DEPARTMENTAL AND OTHER SUPPLIES.,,,"Should this not be by tender, if junk is sold to a reputable firm by tender?

",Laurier Liberal,,Rodolphe Lemieux,http://www.parl.gc.ca/parlinfo/Files/Parliamentarian.aspx?Item=733cae8a-7e57-46c6-ab2e-478ac991835f&Language=E&Section=ALL
536681,ca.proc.d.1919-06-06.13.134,1919-06-06,a43fcba7-73d8-48ff-b457-5740c40cecab,ca.m.3293,Mr. ROWELL:,Minister presiding over the Department of Health; President of the Privy Council,PURCHASING OF DEPARTMENTAL AND OTHER SUPPLIES.,,,"I do not see any objection to putting that in. That is the procedure. I move to amend clause 7 by adding at the end thereof the words "" by tender.""

",Unionist,,Newton Wesley Rowell,http://www.parl.gc.ca/parlinfo/Files/Parliamentarian.aspx?Item=a43fcba7-73d8-48ff-b457-5740c40cecab&Language=E&Section=ALL
536719,ca.proc.d.1919-06-06.13.172,1919-06-06,6c38f39b-1f70-4da5-ac6d-14d796590e55,ca.m.6574,Mr. McKENZIE:,Leader of the Official Opposition,PURCHASING OF DEPARTMENTAL AND OTHER SUPPLIES.,,,"Is there any provision in this Act by which the purchases will be reported to the Auditor General and the Auditor General will have in his report an account of the various purchases made by Ill's commission, showing the departments from which these various requisitions came and the amounts paid for the supplies enumerated in them?

",Laurier Liberal,,Daniel Duncan McKenzie,http://www.parl.gc.ca/parlinfo/Files/Parliamentarian.aspx?Item=6c38f39b-1f70-4da5-ac6d-14d796590e55&Language=E&Section=ALL
536724,ca.proc.d.1919-06-06.13.177,1919-06-06,733cae8a-7e57-46c6-ab2e-478ac991835f,ca.m.4942,Mr. LEMIEUX:,,PURCHASING OF DEPARTMENTAL AND OTHER SUPPLIES.,,,"In view of the explanation, I would most strenuously insist that provision he made that the expenditure should first be voted by Parliament. I quite understand that cases might arise where it would be obviously the duty of the commission to take the state of the market into consideration. For instance, I remember that when the new Parliament buildings were on the point of being commenced the parliamentary committee appointed to
supervise their erection decided to buy the steel framework of the building in advance because it was hinted to one of the members that the price of steel would go up by several points, as it did. Of course, there was a saving by that purchase. But that was a very extraordinary case that occurred during war time. In normal times the commission, I think-indeed, I am positive of it-should not go beyond the amount provided by Parliament for each of the departments. I think my hon. friend ought to make that clear in the Bill.

",Laurier Liberal,,Rodolphe Lemieux,http://www.parl.gc.ca/parlinfo/Files/Parliamentarian.aspx?Item=733cae8a-7e57-46c6-ab2e-478ac991835f&Language=E&Section=ALL
536729,ca.proc.d.1919-06-06.13.182,1919-06-06,d98b30ab-759a-4b5e-b3ba-420ce11b08d2,ca.m.9083,Mr. J. H. SINCLAIR:,,PURCHASING OF DEPARTMENTAL AND OTHER SUPPLIES.,,,"Will the minister consider the advisability of adding something to this section?

",Laurier Liberal,,John Howard Sinclair,http://www.parl.gc.ca/parlinfo/Files/Parliamentarian.aspx?Item=d98b30ab-759a-4b5e-b3ba-420ce11b08d2&Language=E&Section=ALL
536730,ca.proc.d.1919-06-06.13.183,1919-06-06,20153f1d-4d12-4d52-b34f-744ffb0e1cd0,ca.m.7879,The CHAIRMAN:,Deputy Speaker and Chair of Committees of the Whole of the House of Commons,PURCHASING OF DEPARTMENTAL AND OTHER SUPPLIES.,,,"There is a motion by the hon. member for Maisonneuve that the section be allowed to stand. The motion is not debatable. If it is withdrawn the

hon. member for Antigonish and Guysbor-ough (Mr. Sinclair) can discuss the section.

",Laurier Liberal,,Georges Henri Boivin,http://www.parl.gc.ca/parlinfo/Files/Parliamentarian.aspx?Item=20153f1d-4d12-4d52-b34f-744ffb0e1cd0&Language=E&Section=ALL
536423,ca.proc.d.1919-06-06.8.3,1919-06-06,5e8a24b4-f155-4f3d-aacc-e6da13c93756,ca.m.4254,Sir ROBERT BORDEN (Prime Minister):,Prime Minister; Secretary of State for External Affairs,CONFERENCE BETWEEN EMPLOYERS AND EMPLOYED SUGGESTED.,,,"I can answer my hon. friend at once. I delayed giving any definite statement on the subject until I had had opportunity of conferring with the Minister of Labour (Mr. Robertson.). Immediately on his return from Winnipeg I took the matter up with him and he informed me, as I have already stated in the House, that during the past winter and spring he has had many conferences both with employers and employed, and it was because of the suggestion received by him from the employers on the one hand, and from the employed on the other, that he suggested the appointment by Government of the Industrial Commission which is now engaged in investigating these questions in different parts of Canada. Suggestions both as to the scope of the commission and as to its personnel were presented to him by the employers and by the employed. He took all those suggestions into consideration, and I think he gave to both employers and employed the representation which they themselves had proposed. That commission will report, I hope, in a few days. It is understood that immediately on their return on the 15th of June they will make a brief report, to be followed at an early date by a fuller report. The Minister of Labour has the view, which I share, that pending the reception of that report and the information which it will afford, it would be unwise to call the general conference proposed.
There is much, however, which commends itself to my judgment in the suggestion for a general conference, and I can assure my hon. friend that immediately the work of that commission has been completed, and the results of their labours cornmunicated to the Government, most attentive consideration, and I am inclined to think favourable consideration will be given to the suggestion contained in the telegram my hon. friend has just read.

",Unionist,,Robert Laird Borden,http://www.parl.gc.ca/parlinfo/Files/Parliamentarian.aspx?Item=5e8a24b4-f155-4f3d-aacc-e6da13c93756&Language=E&Section=ALL
536424,ca.proc.d.1919-06-06.9,1919-06-06,,,,topic,PURCHASING OF DEPARTMENTAL AND OTHER SUPPLIES.,,,,,,,
536426,ca.proc.d.1919-06-06.9.2,1919-06-06,61c189fb-d551-49ed-82da-cc777b86b056,ca.m.8432,Mr. JACQUES BUREAU (Three Rivers and St. Maurice):,,PURCHASING OF DEPARTMENTAL AND OTHER SUPPLIES.,,,"This is a very important Bill and a good many hon. members have expressed a desire to speak on it. With so many members away on a Friday, I think it is a bad day to take up the Bill. Many hon. members are engaged in law business, and this is the last month before vacation.
If it were possible for the minister to put it off until Monday or Tuesday it would meet the wishes of members on this side of the House.

",Laurier Liberal,,Jacques Bureau,http://www.parl.gc.ca/parlinfo/Files/Parliamentarian.aspx?Item=61c189fb-d551-49ed-82da-cc777b86b056&Language=E&Section=ALL
536449,ca.proc.d.1919-06-06.9.25,1919-06-06,a43fcba7-73d8-48ff-b457-5740c40cecab,ca.m.3293,Mr. ROWELL:,Minister presiding over the Department of Health; President of the Privy Council,PURCHASING OF DEPARTMENTAL AND OTHER SUPPLIES.,,,"I have no knowledge
of the work of the commission prior to the last year and a half; but during this latter period, so far as I have been able to discover, the commission has discharged its duties fairly and impartially, with a high degree of efficiency, and in a manner that has given satisfaction to the business people of this country, and I believe the same may be said of the commission during the whole period of its existence.

",Unionist,,Newton Wesley Rowell,http://www.parl.gc.ca/parlinfo/Files/Parliamentarian.aspx?Item=a43fcba7-73d8-48ff-b457-5740c40cecab&Language=E&Section=ALL
536456,ca.proc.d.1919-06-06.9.32,1919-06-06,d98b30ab-759a-4b5e-b3ba-420ce11b08d2,ca.m.9083,Mr. J. H. SINCLAIR:,,PURCHASING OF DEPARTMENTAL AND OTHER SUPPLIES.,,,"It appeared from a certain investigation before the Public Accounts Committee that extortionate prices were paid for material, and if the commission was responsible for those purchases, I do not think there is any good reason why it should be continued.

",Laurier Liberal,,John Howard Sinclair,http://www.parl.gc.ca/parlinfo/Files/Parliamentarian.aspx?Item=d98b30ab-759a-4b5e-b3ba-420ce11b08d2&Language=E&Section=ALL
536479,ca.proc.d.1919-06-06.9.55,1919-06-06,e702fa8e-c7e6-4906-a69d-bad38613f9e4,ca.m.6325,Mr. FRIPP:,,PURCHASING OF DEPARTMENTAL AND OTHER SUPPLIES.,,,"I will withdraw that statement, Mr. Speaker. I do not purpose to make a speech, but I purpose to offer one or two observations. I am informed not only by merchants who have had dealings with the War Purchasing Commission, but also by purchasing agents of uie different departments, that the operation of this War Purchasing Commission has not been a success.
For example, I am informed that they ask for tenders for certain commodities, returnable on a certain day, but that they do not order the goods until three or four months afterwards. That is to say, no time is stated within which the goods must be delivered if the tender is accepted. The result is that it is impossible for intending tenderers to give the better price, because they do not know the date of delivery, and for that reason the War Purchasing Commission has been paying much larger prices for goods than would be paid if the

purchasing was done upon a more businesslike basis. In fact, I am told that the business of the War Purchasing Commission has been managed by one or two clerks, and that business men who have dealings with them find the commission very unsatisfactory as to prices, date of delivery, and general quantities required. On the other hand, I am informed by purchasing agents of the departments-perhaps more or less in confidence-that they were able to purchase more advantageously for the Government when they purchased solely for their own departments; that they got better delivery and better prices, and that the goods were superior. I am also informed that local purchasing is practically cut out; that the War Purchasing Commission have been buying largely in the United States and that they refuse to recognize local agents for the supplying of goods manufactured in the United States. The result is that a large number of mercantile agents have been unable to do business with this commission. I bring these matters to the attention of the House because 3D think that before we embark upon a scheme which means a large expenditure of public money in the payment of large salaries to members of this commission and its staff, we should investigate the matter more carefully and see whether the system is any improvement over the one that was in vogue prior to the creation of the War Purchasing Commission.

",Unionist,,Alfred Ernest Fripp,http://www.parl.gc.ca/parlinfo/Files/Parliamentarian.aspx?Item=e702fa8e-c7e6-4906-a69d-bad38613f9e4&Language=E&Section=ALL
536480,ca.proc.d.1919-06-06.9.56,1919-06-06,ec66c043-559e-4428-a85e-414d241a4365,ca.m.9476,Mr. JOHN HAROLD (Brant):,,PURCHASING OF DEPARTMENTAL AND OTHER SUPPLIES.,,,"Mr. Speaker, before the Bill goes into Committee I should like to make a few observations dealing with the principles of this measure. You will agree that this is one of the most important subjects from the business standpoint that has been brought before the House this session. I think we should concern ourselves more about the soundness of the principles which underlie this Bill than about the question whether some of the details in connection with the manner in which we have been purchasing recently are an improvement on the methods of the pa*t.
We are departing, by this Bill, from the procedure that has been adopted by the War Purchasing Commission, in that a new organization is being set up. We are combining in one department the experts and others who have been looking after the purchasing in the different departments, in order that these specialists may devote their attention and abilities to work which will benefit all departments. Let me illustrate.

During the fiscal year ended March 31,'1919, provisions were purchased in fifteen departments, dry goods in sixteen, hardware in eighteen, mechanical goods in eighteen, drugs, chemicals and scientific articles in sixteen. This Bill proposes that men shall be engaged as specialists in these different branches of purchasing. One man, for instance, will be an expert on groceries and provisions. It will be his duty to
4 p.m. study the markets, to know the goods, to find out when it will be most favourable for those who are able to tender to supply the goods to the Government. He will select articles as standards that are most generally used, in order to permit a larger number to submit tenders fbr the supplying of those goods.
Another thing we should consider is that the goods themselves must be carefully inspected; tests and analyses of certain articles will be necessary. This commission can better employ these experts and get much better general results in that respect. I know of an instance where a manufacturer was asked to tender for a certain article. He tendered at a wholesale price to the War Purchasing Department, but they purchased the goods from a jobber at a higher price. Now, the Purchasing Department were led to believe that the goods they were purchasing represented better value than those which the manufacturer in question offered to supply; but it turned out that the goods were the same as those bid on by the manufacturer. I do not blame the War Purchasing Commission for that, but under the new system that difficulty would be overcome.

",Unionist,,John Harold,http://www.parl.gc.ca/parlinfo/Files/Parliamentarian.aspx?Item=ec66c043-559e-4428-a85e-414d241a4365&Language=E&Section=ALL
536539,ca.proc.d.1919-06-06.10.1.1.1,1919-06-06,,,,stagedirection,,,,"A message was delivered by Colonel Ernest J. Chambers, Gentleman Usher of the Black Rod, as follows:
Mr. Speaker, the Deputy to His Excellency the Governor General desires the immediate attendance of this honourable House in the Chamber of the Honourable the Senate.
Accordingly, the House went up to the Senate.
And having returned.
The Speaker informed the House that' His Honour the Deputy of His Excellency the Governor General had been pleased to-give in His Majesty's name the Royal assent to the following Bills.
An Act to amend The Dominion Lands Surveys Act.
An Act to amend the Railway Act (Aid for Railway Crossing's).
An Act to amend an Act to fprovide Compensation where Employees of His Majesty are killed or suffer injuries while performing- their duties.
An Act respecting Advances for the Purchase of Seed Grain.
An Act to amend The Currency Act, 1910.
An Act to iprovide for the Continuance in Force of a certain Proclamation made under",,,,
